{"$schema":"https://json-schema.org/draft/2020-12/schema","type":"object","additionalProperties":false,"required":["schema_version","organization_digest","repository_digest","command_id","scope","expires_at","approver"],"properties":{"schema_version":{"const":"1.0.0"},"organization_digest":{"type":"string","pattern":"^[0-9a-f]{64}$"},"repository_digest":{"type":"string","pattern":"^[0-9a-f]{64}$"},"command_id":{"type":"string","minLength":1},"scope":{"const":"required"},"expires_at":{"type":"string","format":"date-time"},"approver":{"type":"string","minLength":1}}}