{"schema_version":"1.0.0","organization_digest":"aaaaaaaaaaaaaaaaaaaaaaaaaaaaaaaaaaaaaaaaaaaaaaaaaaaaaaaaaaaaaaaa","repository_digest":"bbbbbbbbbbbbbbbbbbbbbbbbbbbbbbbbbbbbbbbbbbbbbbbbbbbbbbbbbbbbbbbb","command_id":"test","scope":"required","expires_at":"2027-01-01T00:00:00Z","approver":"release-authority"}